,address,ward,application number,application type,date submitted,status,description,link
68,81 pendrith st,ward 11: university-rosedale,22 112086 ste 11 mv,minor variance,8/2/2022,closed,"to construct a new three-storey ancillary building (one-car garage with a laneway suite above) in the rear yard, abutting the laneway. this ancillary building will have two decks (north and south sides) on the second storey and two decks (west and south sides) on the third storey.",http://app.toronto.ca/AIC/index.do?folderRsn=1wBsqA1mhEMfM1RP7ilYKg%3D%3D
69,481 roxton rd,ward 11: university-rosedale,21 250641 ste 11 mv,minor variance,21/12/2021,closed,to alter the existing two-storey semi-detached dwelling by constructing a complete third storey addition and a rear two-storey addition.,http://app.toronto.ca/AIC/index.do?folderRsn=BbnX9QipYiBM3a2cGwtE6g%3D%3D
70,490 roxton rd,ward 11: university-rosedale,22 155381 ste 11 mv,minor variance,1/6/2022,accepted,"to alter the existing two-storey detached dwelling by constructing: a front and rear basement addition; a front and rear two-storey addition; a new front porch; and a complete third-storey addition with a rear third floor deck. also, to construct a two-storey laneway suite with a single-car garage at the rear yard abutting the laneway. the existing detached garage will be demolished.",http://app.toronto.ca/AIC/index.do?folderRsn=RODXUz5Hir8KIULamFSVGw%3D%3D
71,498 roxton rd,ward 11: university-rosedale,22 114091 ste 11 mv,minor variance,14/02/2022,closed,"to alter the existing building by constructing a second storey addition with a front walkout roof deck, a rear third storey addition, a rear third storey balcony, and a front third storey walkout roof deck.",http://app.toronto.ca/AIC/index.do?folderRsn=m%2B1FkLCKQdv1%2FF0fvFYhNA%3D%3D
72,527 roxton rd,ward 11: university-rosedale,22 145523 ste 11 mv,minor variance,11/5/2022,tentatively scheduled,to alter the existing 2 1/2-storey semi-detached dwelling by constructing a third storey rear addition and some interior alterations.,http://app.toronto.ca/AIC/index.do?folderRsn=vQ%2F6ll%2B2XTQKjK67%2B3nO%2Fg%3D%3D
73,143 rusholme rd,ward 9: davenport,22 118933 ste 09 co,application for consent,2/3/2022,application withdrawn,proposed eliminate completely the right of way between house,http://app.toronto.ca/AIC/index.do?folderRsn=We%2BQZCSmNj6ExRPFPqd5WA%3D%3D
74,143 rusholme rd,ward 9: davenport,22 118958 ste 09 co,application for consent,2/3/2022,application withdrawn,proposed to reduce the width of the right of way between house,http://app.toronto.ca/AIC/index.do?folderRsn=Ig%2B3Wp5sCKGyRSKdomngvg%3D%3D
75,143 rusholme rd,ward 9: davenport,22 118906 ste 09 mv,minor variance,2/3/2022,postponed,"to construct a new three-storey dwelling with a rear ground floor deck, and front and rear third storey decks.",http://app.toronto.ca/AIC/index.do?folderRsn=VtErHjSzpRChd3liCjcMFw%3D%3D
76,268 rusholme rd,ward 9: davenport,22 138859 ste 09 mv,minor variance,27/04/2022,tentatively scheduled,interior alterations throughout and new front walkout,http://app.toronto.ca/AIC/index.do?folderRsn=ZRaWt%2F%2BFyAGPnsmfqwR9AQ%3D%3D
77,386 rusholme rd,ward 9: davenport,21 166120 ste 09 co,application for consent,5/6/2021,conditional consent,to obtain consent for a technical severance to re-establish two residential lots which merged on title.,http://app.toronto.ca/AIC/index.do?folderRsn=R1jvRZASFwz%2FGu%2FxCFdILQ%3D%3D
78,20 russett ave,ward 9: davenport,22 145260 ste 09 mv,minor variance,11/5/2022,postponed,proposal to construct a new second floor laneway suite addition over the existing rear yard one storey detached private garage and construct a new rear yard supplementary spiral staircase for the existing main dwelling on the lot.,http://app.toronto.ca/AIC/index.do?folderRsn=jjVW5xfhlmVswTTx5XXuZg%3D%3D
79,652 shaw st,ward 11: university-rosedale,22 137936 ste 11 mv,minor variance,25/04/2022,tentatively scheduled,"to alter the existing building by constructing a rear basement walkout, a rear ground floor deck, a rear third storey addition, and a rear third storey rooftop terrace. also, to construct a rear detached garage.",http://app.toronto.ca/AIC/index.do?folderRsn=I76fjndM2lmOB2LUn3mDqw%3D%3D
80,703 shaw st,ward 11: university-rosedale,21 252277 ste 11 mv,minor variance,30/12/2021,tentatively scheduled,"to alter the existing two-and-one-half-storey semi-detached dwelling by reconstructing a new front porch with balcony above and to construct a rear one-storey ancillary building (detached garage), abutting the laneway.",http://app.toronto.ca/AIC/index.do?folderRsn=O3QpX3fJE12XtiVQtb7UnA%3D%3D
81,804 shaw st,ward 11: university-rosedale,22 109048 ste 11 mv,minor variance,31/01/2022,accepted,alter the existing semi-detached dwelling by constructing a complete third storey.,http://app.toronto.ca/AIC/index.do?folderRsn=pp33F9RK1JS7kZCtMlNsEg%3D%3D
82,998 shaw st,ward 11: university-rosedale,22 129407 ste 11 mv,minor variance,1/4/2022,tentatively scheduled,"to alter the existing two-storey detached dwelling by constructing a rear two-storey addition, a rear ground floor concrete landing and stairs, and a rear second floor balcony.",http://app.toronto.ca/AIC/index.do?folderRsn=b2%2Bje%2FPsX4qHTw5wH0VSQA%3D%3D
83,57 sylvan ave,ward 9: davenport,21 249724 ste 09 mv,minor variance,17/12/2021,closed,to convert the existing two-storey building from a day nursery (childcare centre) into a private elementary school.,http://app.toronto.ca/AIC/index.do?folderRsn=Trq3uv7XVSyahCYTKl%2F7gQ%3D%3D
84,19 wallace ave,ward 9: davenport,22 108537 ste 09 mv,minor variance,28/01/2022,hearing scheduled,"to alter the existing two-storey detached dwelling by constructing a new front two-storey addition,  a new rear deck and a walkout basement to access the secondary suite within the basement.",http://app.toronto.ca/AIC/index.do?folderRsn=ekazHqqncytRnXcOmg70QA%3D%3D
85,210 yarmouth rd,ward 11: university-rosedale,22 125102 ste 11 mv,minor variance,21/03/2022,hearing scheduled,"to alter the existing two-storey detached dwelling by constructing a third storey addition with a new front porch. also, to construct a three-storey addition at the northeast portion of the dwelling with a read ground floor deck.",http://app.toronto.ca/AIC/index.do?folderRsn=wJQg2UopXhNXnKDoLKnlqA%3D%3D
